{
  "schemaVersion": 1,
  "id": "main6-smoke",
  "maxDurationSeconds": 600,
  "minConnectedSeconds": 300,
  "expectedPlayers": 6,
  "requireMovement": true,
  "requireZone": true,
  "requireHpDamage": true,
  "requireResult": true,
  "requireReplay": true,
  "requireHistory": true,
  "minInputHz": 28.5,
  "minSnapshotHz": 28.5,
  "maxPongTimeoutRatio": 0.01,
  "driver": "movement",
  "extraAssertions": []
}
